[
  {
    "id": "kb_001",
    "name": "MX Keys Mini 무선 기계식 키보드",
    "url": "https://example.com/products/mx-keys-mini",
    "category": "keyboard",
    "price": 139000,
    "description": "콤팩트한 텐키리스 디자인의 최고급 무선 기계식 키보드. 스마트 백라이트와 이지스위치 탑재.",
    "images": [
      "https://example.com/images/mx-keys-mini-1.jpg",
      "https://example.com/images/mx-keys-mini-2.jpg"
    ]
  },
  {
    "id": "kb_002",
    "name": "한성컴퓨터 GK893B 염료승화 무접점 키보드",
    "url": "https://example.com/products/hansung-gk893b",
    "category": "keyboard",
    "price": 145000,
    "description": "구름을 걷는 듯한 부드러운 타건감의 무접점 키보드. 블루투스 5.0 멀티페어링 지원.",
    "images": [
      "https://example.com/images/gk893b-1.jpg"
    ]
  },
  {
    "id": "kb_003",
    "name": "로지텍 K380 멀티 디바이스 블루투스 키보드",
    "url": "https://example.com/products/logitech-k380",
    "category": "keyboard",
    "price": 34900,
    "description": "가볍고 휴대하기 좋은 미니멀한 디자인의 블루투스 키보드. 최대 3대 디바이스 동시 연결.",
    "images": [
      "https://example.com/images/k380-1.jpg"
    ]
  },
  {
    "id": "pad_001",
    "name": "프리미엄 펠트 데스크 매트 L",
    "url": "https://example.com/products/felt-desk-mat",
    "category": "desk-accessory",
    "price": 24900,
    "description": "따뜻하고 고급스러운 느낌의 양모 펠트 데스크 매트. 논슬립 패드로 밀림 방지.",
    "images": [
      "https://example.com/images/felt-mat-1.jpg"
    ]
  },
  {
    "id": "pad_002",
    "name": "로지텍 데스크 매트 Studio Series",
    "url": "https://example.com/products/logitech-desk-mat",
    "category": "desk-accessory",
    "price": 21900,
    "description": "부드럽고 편안한 패브릭 소재의 방수 설계 마우스 장패드. 미끄럼 방지 고무 베이스.",
    "images": [
      "https://example.com/images/logi-mat-1.jpg"
    ]
  }
]