[
  {
    "id": "kb_001",
    "name": "MX Keys Mini 무선 기계식 키보드",
    "url": "https://example.com/products/mx-keys-mini",
    "category": "keyboard",
    "price": 139000,
    "description": "콤팩트한 텐키리스 디자인의 최고급 무선 기계식 키보드. 스마트 백라이트와 이지스위치 탑재.",
    "images": [
      "https://example.com/images/mx-keys-mini-1.jpg"
    ]
  },
  {
    "id": "pad_001",
    "name": "프리미엄 펠트 데스크 매트 L",
    "url": "https://example.com/products/felt-desk-mat",
    "category": "desk-accessory",
    "price": 24900,
    "description": "따뜻하고 고급스러운 느낌의 양모 펠트 데스크 매트. 논슬립 패드로 밀림 방지.",
    "images": [
      "https://example.com/images/felt-mat-1.jpg"
    ]
  }
]
