[
  {
    "id": "kb_001",
    "name": "MX Keys Mini 무선 기계식 키보드",
    "url": "https://example.com/products/mx-keys-mini",
    "category": "keyboard",
    "price": 139000,
    "description": "콤팩트한 텐키리스 디자인의 최고급 무선 기계식 키보드. 스마트 백라이트와 이지스위치 탑재.",
    "images": [
      "https://example.com/images/mx-keys-mini-1.jpg"
    ]
  },
  {
    "id": "pad_001",
    "name": "프리미엄 펠트 데스크 매트 L",
    "url": "https://example.com/products/felt-desk-mat",
    "category": "desk-accessory",
    "price": 24900,
    "description": "따뜻하고 고급스러운 느낌의 양모 펠트 데스크 매트. 논슬립 패드로 밀림 방지.",
    "images": [
      "https://example.com/images/felt-mat-1.jpg"
    ]
  },
  {
    "id": "kb_001",
    "name": "MX Keys Mini 무선 기계식 키보드 (중복 건)",
    "url": "https://example.com/products/mx-keys-mini",
    "category": "keyboard",
    "price": 139000,
    "description": "콤팩트한 텐키리스 디자인의 최고급 무선 기계식 키보드. 스마트 백라이트와 이지스위치 탑재.",
    "images": [
      "https://example.com/images/mx-keys-mini-1.jpg"
    ]
  },
  {
    "id": "bad_001",
    "name": "이미지가 누락된 마우스",
    "url": "https://example.com/products/no-image-mouse",
    "category": "mouse",
    "price": 45000,
    "description": "이 제품은 이미지가 전혀 없는 상태여서 숏폼 영상 제작에 적합하지 않습니다.",
    "images": []
  },
  {
    "id": "bad_002",
    "name": "설명이 너무 짧은 손목 보호대",
    "url": "https://example.com/products/short-desc",
    "category": "desk-accessory",
    "price": 12000,
    "description": "짧은글",
    "images": [
      "https://example.com/images/wrist-1.jpg"
    ]
  },
  {
    "id": "bad_003",
    "name": "가격이 비정상인 모니터 스탠드",
    "url": "https://example.com/products/zero-price",
    "category": "desk-accessory",
    "price": 0,
    "description": "가격이 0원 이하로 표시되어 있어 유효하지 않은 상품 정보입니다.",
    "images": [
      "https://example.com/images/stand-1.jpg"
    ]
  },
  {
    "id": "bad_004",
    "name": "타겟 외 카테고리 여성 스니커즈",
    "url": "https://example.com/products/fashion-shoes",
    "category": "fashion",
    "price": 59000,
    "description": "데스크테리어 및 모바일 생산성 카테고리가 아닌 패션 잡화 상품입니다.",
    "images": [
      "https://example.com/images/shoes-1.jpg"
    ]
  }
]
